49,"2019-03-19 11:52:53",,,,,,"Poorly conducted research, e.g., failure to randomise, failure to blind",,,Insufficient training of researchers and supervisors in research reproducibility and basic study design,,Insufficient use of research design and reporting guidelines (EQUATOR),,,,Poor research culture of institutions/research groups,,,,,Discrimination against female researchers,,"There is a lack of a coordinated approach to translation of research findings. The onus falls on the researcher to tackle policy makers etc but this is rarely factored in to grant applications and therefore falls down - leaving the researcher feeling like all the planning and effort involved in conducting a high quality, rigorous study was wasted.    Predatory journals are also a big concern - how is the general public/media to decipher what's real and what's not?","Better and continued training in research methods at all career stages, ideally using a national model that is available to all researchers",,"Requiring that all Australian trials be registered, make a protocol available, and publish their results, with consequences for researchers who fail to comply",,,,,,,,,,,Policies to encourage wider use of project management tools such as github and training in version control,,That Australia implement a program similar to the UK's foresight scheme where policy makers and academics work together for 12 months to develop evidence-based policies on important national issues,,A national inquiry into the burden of research ethics and governance in health and medical research Australia,,,,"At a very grass roots level, all researcher who are involved in human research should have minimum training requirements (eg. Good Clinical Practice training; data management/statistical methods knowledge - not just 'how to' but 'why' as well to ensure that practices such as mining for p values and poor research conduct is discouraged). I know this won't stamp it out entirely, but it would be a start. Journals also need to get tougher with authors and need to ask for more proof that the study has been conducted rigorously. ","We engage a statistician at the very outset to ensure methodological rigour. We have recently started engaging more with patients to ensure that our outcomes are patient important. The initial research idea comes from the clinical area we work in (through communications with clinicians to identify clinical practices in need of improvement/refinement; or analysis of patient safety data/sentinel events) - so hopefully the research is relevant to clinicians who are caring for the patients, and the patients themselves.","None - which is appalling. There are no minimum requirements set at an institutional level - the onus is wholly and solely on the investigator to ensure that they do the right thing, and unfortunately there are investigators who are only driven by publications and accolades, with only passing acknowledgement to how their research will improve things for patients. ",Clinical Sciences,
50,"2019-03-19 12:36:36",,,,,,,Unwillingness of journals and researchers to publish null results or replication studies,"Inappropriate academic incentives (“publish or perish” reward systems focus on citations, especially in “top” journals, rather than research resulting in real changes to practice)",,,,,,,Poor research culture of institutions/research groups,Too much competition for too little funding,,,,,Researchers and the media hyping preliminary results that give the public false hope,"The major issue is the high stress funding system which encourages (or forces) unethical scientific practices. While competitiveness should be encouraged, current funding system only encourages stressful management of research projects and often results in bad quality data being published, for the sake of publications rather than ensuring bigger picture publications or answering key questions. ",,,,,That some funding be specifically set aside to fund replication studies,,,,Lobbying universities to downplay league tables (like the Times Higher Education tables) and focus on real benefits to patients and the public,Revising academic incentives so that replication/reproducibility studies and open practices are highly valued,,,,,,That Australia implement a program similar to the UK's foresight scheme where policy makers and academics work together for 12 months to develop evidence-based policies on important national issues,,,That a national advisory board for research integrity be created (see this recent article on plans in the US),,,,Utilise appropriate controls.  Minimise Animal health burden and impacts.   Using appropriate health models.,Most of the policies UQ implements is to maximise publication numbers/impact factors rather than the focus of research quality or ethical practices. ,Basic Science,
51,"2019-03-20 08:53:05",,,Low rates of data and code sharing,,,,,"Inappropriate academic incentives (“publish or perish” reward systems focus on citations, especially in “top” journals, rather than research resulting in real changes to practice)",,,,,Insufficient national oversight of universities and research institutes,,,Too much competition for too little funding,Suppression/sanitisation of unfavourable or commercially damaging results,,,,,"More financial support needed in terms of grants for PhD students - scholarships only cover cost of living, need more financial assistance available for the research itself. ",,,,,,,,,,,,,,,,,,,,,,,,,,
52,"2019-03-20 13:06:26",,Low numbers of replication studies performed (for lack of funding or other reasons),,,,"Poorly conducted research, e.g., failure to randomise, failure to blind",,"Inappropriate academic incentives (“publish or perish” reward systems focus on citations, especially in “top” journals, rather than research resulting in real changes to practice)",,Over-emphasis on p-values/statistical significance and re-analysing data until statistical significance is achieved,,,,,,,,,,,Researchers and the media hyping preliminary results that give the public false hope,,,,,,That some funding be specifically set aside to fund replication studies,,,,,,,,,,,,,A national inquiry into the burden of research ethics and governance in health and medical research Australia,,,,,,,Health Services Research,
53,"2019-03-21 11:45:10",,,,,,,,,,,,,,,,,,,,,,,,,,,,,,,,,,,,,,,,,,,,,,,,
54,"2019-03-21 16:08:55",,,,,Lack of involvement of statisticians and epidemiologists on research teams,"Poorly conducted research, e.g., failure to randomise, failure to blind",,,Insufficient training of researchers and supervisors in research reproducibility and basic study design,,Insufficient use of research design and reporting guidelines (EQUATOR),,,,,,Suppression/sanitisation of unfavourable or commercially damaging results,,,,,"1. Failure to build on previous research - by doing systematic reviews of previous research before new research.  2. Poor research questions that focus on a do-able publication rather than as a step to answering a real problem (Pasteur’s Quadrant).  3. Weak collaborative research networks, particularly for multicentre basic science.","Better and continued training in research methods at all career stages, ideally using a national model that is available to all researchers",,"Requiring that all Australian trials be registered, make a protocol available, and publish their results, with consequences for researchers who fail to comply",,,,,,,,,"Australia to set-up a James Lind Alliance to bring together clinicians, patients and carers to discuss research priorities",,,,,,A national inquiry into the burden of research ethics and governance in health and medical research Australia,,That specific funding be made available for meta-research (researching the research process) and journalology (the science of publication practices),,"Extend the last option beyond trials - that all types of research be registered.  Also funding to automation of research synthesis - failure to know what we already know is holding us back, but doing manually is too slow.",Systematic reviews before new research (done used automation tools).  Protocol templates for research protocols and papers.  Training of all research staff in research and synthesis methods.,Research Integrity training,Clinical Sciences,
55,"2019-03-22 15:18:14",,Low numbers of replication studies performed (for lack of funding or other reasons),,,,,Unwillingness of journals and researchers to publish null results or replication studies,"Inappropriate academic incentives (“publish or perish” reward systems focus on citations, especially in “top” journals, rather than research resulting in real changes to practice)",,,,,,,,Too much competition for too little funding,Suppression/sanitisation of unfavourable or commercially damaging results,,,,,Lack of applied researchers or research with practical application ,,,,,,,,,Lobbying universities to downplay league tables (like the Times Higher Education tables) and focus on real benefits to patients and the public,,,"Australia to set-up a James Lind Alliance to bring together clinicians, patients and carers to discuss research priorities",,,,That Australia implement a program similar to the UK's foresight scheme where policy makers and academics work together for 12 months to develop evidence-based policies on important national issues,That specific funding be set aside for truly innovative projects,,,,,Greater funding for research and practice partnerships,,,Health Services Research,